{
  "job_id": "r-mgk3x2-000042-load-a1",
  "run_id": "r-mgk3x2-000042",
  "load_seq": 1760100000000042,
  "kind": "load",
  "attempt": 1,
  "mode": "incremental",
  "input": {
    "from_snapshot": "6917324011837466517",
    "full_refresh": false
  },
  "lease_seconds": 600,
  "faults": [
    {
      "run_seq": 42,
      "kind": "crash_after_load"
    }
  ]
}
